{
  "type": "SoftwareApplication",
  "name": "Git",
  "description": "Distributed version control system that enables collaborative research software development, change tracking, and version management, essential for research software maintainability and reproducibility throughout the development lifecycle.",
  "url": "https://git-scm.com/",
  "applicationCategory": "Development",
  "hasQualityDimension": [
    "Maintainability"
  ],
  "segment": "Software engineering & development practices",
  "ring": "Adopt"
}