{
  "type": "SoftwareApplication",
  "name": "Kubernetes",
  "description": "Container orchestration platform that automates deployment, scaling, and management of research software applications, improving reliability, maintainability, and sustainability through robust infrastructure management and service mesh capabilities.",
  "url": "https://kubernetes.io/",
  "applicationCategory": "Platform",
  "hasQualityDimension": [
    "Maintainability",
    "Sustainability",
    "Reliability"
  ],
  "segment": "Infrastructure & Platform Engineering",
  "ring": "Adopt"
}