{
  "type": "SoftwareApplication",
  "name": "Jupyter",
  "description": "Open-source web application for creating and sharing live code, equations, visualizations, and narrative text, enhancing research software development and collaboration through interactive computing environments.",
  "url": "https://jupyter.org/",
  "applicationCategory": "Development",
  "hasQualityDimension": [
    "Maintainability",
    "Interaction Capability"
  ],
  "segment": "Software engineering & development practices",
  "ring": "Adopt"
}