{
  "type": "SoftwareApplication",
  "name": "pydantic",
  "description": "Data validation and settings management using Python type annotations. Pydantic enforces type correctness at runtime.",
  "url": "https://docs.pydantic.dev/",
  "applicationCategory": "CodeQuality",
  "segment": "Software engineering & development practices",
  "ring": "Adopt"
}