{
  "type": "SoftwareApplication",
  "name": "sphinx",
  "description": "Documentation generator that creates comprehensive, searchable documentation from source code and reStructuredText files, improving research software maintainability and usability through professional documentation.",
  "url": "https://www.sphinx-doc.org",
  "applicationCategory": "Documentation",
  "hasQualityDimension": [
    "Maintainability"
  ],
  "segment": "Software engineering & development practices",
  "ring": "Adopt"
}