{
  "type": "SoftwareApplication",
  "name": "yamllint",
  "description": "yamllint is a linter for YAML files that checks for syntax validity and enforces consistent formatting, helping to catch errors early and maintain clean, readable configuration files.",
  "url": "https://github.com/adrienverge/yamllint",
  "applicationCategory": "CodeQuality",
  "hasQualityDimension": [
    "Maintainability"
  ],
  "segment": "Software engineering & development practices",
  "ring": "Adopt"
}