{
  "type": "SoftwareApplication",
  "name": "pytest",
  "description": "A mature testing framework for Python that supports unit, functional, and integration testing with powerful plugins.",
  "url": "https://docs.pytest.org",
  "applicationCategory": "Testing",
  "hasQualityDimension": [
    "Maintainability",
    "Reliability"
  ],
  "segment": "Software engineering & development practices",
  "ring": "Adopt"
}