{
  "type": "SoftwareApplication",
  "name": "MkDocs",
  "description": "Static site generator designed for project documentation that creates professional documentation websites from Markdown files, improving research software usability and interaction capability through clear documentation.",
  "url": "https://www.mkdocs.org/",
  "applicationCategory": "Documentation",
  "hasQualityDimension": [
    "Interaction Capability",
    "Maintainability"
  ],
  "segment": "Software engineering & development practices",
  "ring": "Adopt"
}